{"arm":"sequential","attemptId":"sample-p1-seq","benchmarkReceiptDigest":"sha256:bbbbbbbbbbbbbbbbbbbbbbbbbbbbbbbbbbbbbbbbbbbbbbbbbbbbbbbbbbbbbbbb","completeness":"complete","incompleteReasons":[],"pairNumber":1,"runId":"cb-20260901-0123456789abcdef","schemaVersion":"compass-builder.benchmark-attempt-usage.v1","summary":{"attemptedStoryCount":1,"successfulStoryCount":1,"tokens":{"cacheWriteInputTokens":0,"cachedInputRatio":"0.400000","cachedInputTokens":40,"comparisonTokens":120,"comparisonTokensPerAttemptedStory":"120.000000","comparisonTokensPerSuccessfulStory":"120.000000","failedAttemptComparisonTokens":0,"inputTokens":100,"outputTokens":20,"reasoningOutputShare":"0.250000","reasoningOutputTokens":5,"retryComparisonTokens":0},"workerAttemptCount":1},"trialNumber":1,"warmup":false,"workerUsageRecords":[{"attempt":1,"effort":"low","exactModel":"gpt-5.6-sol","launchDigest":"sha256:aaaaaaaaaaaaaaaaaaaaaaaaaaaaaaaaaaaaaaaaaaaaaaaaaaaaaaaaaaaaaaaa","observed":true,"runId":"cb-20260901-0123456789abcdef","schemaVersion":"compass-builder.worker-usage.v1","source":"codex-exec-jsonl-stdout","storyId":"alpha","terminalStatus":"succeeded","unavailableReason":null,"usage":{"cacheWriteInputTokens":0,"cacheWriteInputTokensPresent":false,"cachedInputTokens":40,"inputTokens":100,"outputTokens":20,"reasoningOutputTokens":5},"workerReceiptDigest":null}],"workers":[{"attempt":1,"launchDigest":"sha256:aaaaaaaaaaaaaaaaaaaaaaaaaaaaaaaaaaaaaaaaaaaaaaaaaaaaaaaaaaaaaaaa","runId":"cb-20260901-0123456789abcdef","storyId":"alpha","terminalStatus":"succeeded","verifiedIntegrated":true,"workerUsageDigest":"sha256:727aac800040c67ab7069d42e31dd7d712c87edefbef9919f8ed9fa9aa7785d5"}],"workloadId":"sample"}
